{
  "schema": "zp-eval/corpus/v1",
  "description": "Expanded evaluation corpus n=39 (Kali WSL2 kernel 6.18.33 + multipass Ubuntu 22.04 kernel 5.15.0). 37 planted targets + 2 clean-host baselines. provisioner=ssh (local host).",
  "defaults": {
    "provisioner": "ssh",
    "zp_binary": "./build/bin/z_privesc",
    "timeout_sec": 300,
    "baselines": ["lynis", "linpeas"]
  },
  "targets": [
    {
      "id": "local-sudoers-nopasswd",
      "distro": "kali", "release": "2026.2", "kernel": "6.18.33.2",
      "provisioner": "ssh",
      "setup": "testbeds/sudoers/setup.sh",
      "teardown": "testbeds/sudoers/cleanup.sh",
      "ground_truth": {
        "root_reachable": true,
        "reachable_tokens": ["EXEC_AS_ROOT", "ROOT"],
        "expected_paths": ["EXEC_AS_ROOT -> root"],
        "expected_findings": ["zprivesc-nopasswd"],
        "notes": "NOPASSWD sudoers drop-in grants direct root execution."
      },
      "verify": [
        { "label": "execute code as root", "kind": "path", "manual": true, "expected_y": 1,
          "notes": "Escalation confirmed out-of-band." }
      ]
    },
    {
      "id": "local-suid-root",
      "distro": "kali", "release": "2026.2", "kernel": "6.18.33.2",
      "provisioner": "ssh",
      "setup": "testbeds/suid/setup.sh",
      "teardown": "testbeds/suid/cleanup.sh",
      "ground_truth": {
        "root_reachable": true,
        "reachable_tokens": ["EXEC_AS_ROOT", "ROOT"],
        "expected_paths": ["EXEC_AS_ROOT -> root"],
        "expected_findings": ["bash-root-suid"],
        "notes": "Dangerous SUID root shell binary."
      },
      "verify": [
        { "label": "execute code as root", "kind": "path", "manual": true, "expected_y": 1,
          "notes": "SUID root shell confirmed out-of-band." }
      ]
    },
    {
      "id": "local-capabilities-setuid",
      "distro": "kali", "release": "2026.2", "kernel": "6.18.33.2",
      "provisioner": "ssh",
      "setup": "testbeds/capabilities/setup.sh",
      "teardown": "testbeds/capabilities/cleanup.sh",
      "ground_truth": {
        "root_reachable": true,
        "reachable_tokens": ["SETUID_CAP", "EXEC_AS_ROOT", "ROOT"],
        "expected_paths": ["SETUID_CAP -> root"],
        "expected_findings": ["python3-cap"],
        "notes": "File capability cap_setuid on python3."
      },
      "verify": [
        { "label": "use file capability to setuid", "kind": "path", "manual": true, "expected_y": 1,
          "notes": "cap_setuid confirmed out-of-band." }
      ]
    },
    {
      "id": "local-writable-etc-sudoers",
      "distro": "kali", "release": "2026.2", "kernel": "6.18.33.2",
      "provisioner": "ssh",
      "setup": "testbeds/writable_etc/setup.sh",
      "teardown": "testbeds/writable_etc/cleanup.sh",
      "ground_truth": {
        "root_reachable": true,
        "reachable_tokens": ["WRITE_SUDOERS", "EXEC_AS_ROOT", "ROOT"],
        "expected_paths": ["WRITE_SUDOERS -> root"],
        "expected_findings": ["zprivesc-weak"],
        "notes": "World-writable /etc/sudoers.d drop-in."
      },
      "verify": [
        { "label": "append NOPASSWD to sudoers", "kind": "path", "manual": true, "expected_y": 1,
          "notes": "Writable sudoers confirmed out-of-band." }
      ]
    },
    {
      "id": "local-ssh-root-key",
      "distro": "kali", "release": "2026.2", "kernel": "6.18.33.2",
      "provisioner": "ssh",
      "setup": "testbeds/ssh_keys/setup.sh",
      "teardown": "testbeds/ssh_keys/cleanup.sh",
      "ground_truth": {
        "root_reachable": true,
        "reachable_tokens": ["READ_ROOT_KEY", "ROOT"],
        "expected_paths": ["READ_ROOT_KEY -> root"],
        "expected_findings": ["id_ed25519"],
        "notes": "World-readable root SSH private key."
      },
      "verify": [
        { "label": "SSH in as root with stolen key", "kind": "path", "manual": true, "expected_y": 1,
          "notes": "Root SSH key confirmed out-of-band." }
      ]
    },
    {
      "id": "local-groups-docker",
      "distro": "kali", "release": "2026.2", "kernel": "6.18.33.2",
      "provisioner": "ssh",
      "setup": "testbeds/groups/setup.sh",
      "teardown": "testbeds/groups/cleanup.sh",
      "ground_truth": {
        "root_reachable": true,
        "reachable_tokens": ["CONTAINER_ESCAPE", "ROOT"],
        "expected_paths": ["CONTAINER_ESCAPE -> root"],
        "expected_findings": ["docker"],
        "notes": "User in docker group."
      },
      "verify": [
        { "label": "escape container to host root", "kind": "path", "manual": true, "expected_y": 1,
          "notes": "Docker group confirmed out-of-band." }
      ]
    },
    {
      "id": "local-service-systemd",
      "distro": "kali", "release": "2026.2", "kernel": "6.18.33.2",
      "provisioner": "ssh",
      "setup": "testbeds/service/setup.sh",
      "teardown": "testbeds/service/cleanup.sh",
      "ground_truth": {
        "root_reachable": true,
        "reachable_tokens": ["WRITE_SYSTEMD", "EXEC_AS_ROOT", "ROOT"],
        "expected_paths": ["WRITE_SYSTEMD -> root"],
        "expected_findings": ["zprivesc-weak.service"],
        "notes": "Writable root-run systemd unit."
      },
      "verify": [
        { "label": "hijack a root-run systemd unit", "kind": "path", "manual": true, "expected_y": 1,
          "notes": "Writable systemd unit confirmed out-of-band." }
      ]
    },
    {
      "id": "local-cron-root",
      "distro": "kali", "release": "2026.2", "kernel": "6.18.33.2",
      "provisioner": "ssh",
      "setup": "testbeds/cron/setup.sh",
      "teardown": "testbeds/cron/cleanup.sh",
      "ground_truth": {
        "root_reachable": true,
        "reachable_tokens": ["WRITE_CRON", "EXEC_AS_ROOT", "ROOT"],
        "expected_paths": ["WRITE_CRON -> root"],
        "expected_findings": ["cron.d/zprivesc-weak"],
        "notes": "Writable root-run cron job."
      },
      "verify": [
        { "label": "hijack a root-run cron job", "kind": "path", "manual": true, "expected_y": 1,
          "notes": "Writable cron confirmed out-of-band." }
      ]
    },
    {
      "id": "local-ld-preload",
      "distro": "kali", "release": "2026.2", "kernel": "6.18.33.2",
      "provisioner": "ssh",
      "setup": "testbeds/ld_preload/setup.sh",
      "teardown": "testbeds/ld_preload/cleanup.sh",
      "ground_truth": {
        "root_reachable": true,
        "reachable_tokens": ["INJECT_PRELOAD", "EXEC_AS_ROOT", "ROOT"],
        "expected_paths": ["INJECT_PRELOAD -> root"],
        "expected_findings": ["zprivesc-weak.conf"],
        "notes": "World-writable ld.so.conf drop-in."
      },
      "verify": [
        { "label": "LD_PRELOAD into root processes", "kind": "path", "manual": true, "expected_y": 1,
          "notes": "Writable ld.so.conf confirmed out-of-band." }
      ]
    },
    {
      "id": "local-polkit-pkexec",
      "distro": "kali", "release": "2026.2", "kernel": "6.18.33.2",
      "provisioner": "ssh",
      "setup": "testbeds/polkit/setup.sh",
      "teardown": "testbeds/polkit/cleanup.sh",
      "ground_truth": {
        "root_reachable": true,
        "reachable_tokens": ["POLKIT_LPE", "ROOT"],
        "expected_paths": ["POLKIT_LPE -> root"],
        "expected_findings": ["PKEXEC-CVE-2021-4034"],
        "notes": "pkexec SUID + vulnerable polkit."
      },
      "verify": [
        { "label": "exploit polkit/pkexec", "kind": "path", "manual": true, "expected_y": 1,
          "notes": "Polkit CVE confirmed out-of-band." }
      ]
    },
    {
      "id": "local-kernel-hardening",
      "distro": "kali", "release": "2026.2", "kernel": "6.18.33.2",
      "provisioner": "ssh",
      "setup": "testbeds/kernel_hardening/setup.sh",
      "teardown": "testbeds/kernel_hardening/cleanup.sh",
      "ground_truth": {
        "root_reachable": true,
        "reachable_tokens": ["KERNEL_LPE", "ROOT"],
        "expected_paths": ["KERNEL_LPE -> root"],
        "expected_findings": ["KHARD"],
        "notes": "Kernel hardening weakness."
      },
      "verify": [
        { "label": "run kernel LPE exploit", "kind": "path", "manual": true, "expected_y": 1,
          "notes": "Kernel LPE weakness confirmed out-of-band." }
      ]
    },
    {
      "id": "local-writable-path-trojan",
      "distro": "kali", "release": "2026.2", "kernel": "6.18.33.2",
      "provisioner": "ssh",
      "setup": "testbeds/writable_path/setup.sh",
      "teardown": "testbeds/writable_path/cleanup.sh",
      "ground_truth": {
        "root_reachable": true,
        "reachable_tokens": ["WRITE_PATH_TROJAN", "EXEC_AS_ROOT", "ROOT"],
        "expected_paths": ["WRITE_PATH_TROJAN -> root"],
        "expected_findings": ["evil-path"],
        "notes": "Writable PATH directory with trojan."
      },
      "verify": [
        { "label": "plant trojan in writable PATH", "kind": "path", "manual": true, "expected_y": 1,
          "notes": "PATH trojan confirmed out-of-band." }
      ]
    },
    {
      "id": "local-process-root",
      "distro": "kali", "release": "2026.2", "kernel": "6.18.33.2",
      "provisioner": "ssh",
      "setup": "testbeds/process/setup.sh",
      "teardown": "testbeds/process/cleanup.sh",
      "ground_truth": {
        "root_reachable": true,
        "reachable_tokens": ["EXEC_AS_ROOT", "ROOT"],
        "expected_paths": ["EXEC_AS_ROOT -> root"],
        "expected_findings": ["ww-root-proc"],
        "notes": "Writable root-owned process."
      },
      "verify": [
        { "label": "execute code as root", "kind": "path", "manual": true, "expected_y": 1,
          "notes": "Writable root process confirmed out-of-band." }
      ]
    },
    {
      "id": "local-docker-socket",
      "distro": "kali", "release": "2026.2", "kernel": "6.18.33.2",
      "provisioner": "ssh",
      "setup": "testbeds/docker/setup.sh",
      "teardown": "testbeds/docker/cleanup.sh",
      "ground_truth": {
        "root_reachable": true,
        "reachable_tokens": ["CONTAINER_ESCAPE", "ROOT"],
        "expected_paths": ["CONTAINER_ESCAPE -> root"],